{
    "$schema": "../composition.schema.json",
    "tuningReference": {
        "type": "concertPitch",
        "concertPitchToBaseInterval": "3/2",
        "baseMidiNote": 76,
        "concertPitchFrequency": 432
    },
    "definitions": {
        "scales": {
            "ussak": "ussak.jscl",
            "rast": ["9/8", "fgd"],
            "&^&": null
        }
    },
    "tunings": [

    ],
    "defaultFill": {
        "transposition": "3/2",
        "transpositionIntervalNumber": 5,
        "scale": "rast.jscl",
        "tuningMapper": {
            "type": "manual",
            "keyboardMapping": [0, null, 2, 3, 4, 5, 6, 7, 8, 9, 10, 11]
        }
    },
    "baseUri": "/path/to/file",
    "settings": {
        "tuningMapper": {
            "manual": {
                "keyboardMapping": [0, null, 2, 3, 4, 5, 6, 7, 8, 9, 10, 11]
            },
            "auto": {
                "shouldMapQuarterTonesLow": true
            }
        }
    }
}